id,imdb_id,popularity,budget,revenue,original_title,cast,homepage,director,tagline,keywords,overview,runtime,genres,production_companies,release_date,vote_count,vote_average,release_year,budget_adj,revenue_adj
19995,tt0499549,9.432768,237000000,2781505847,Avatar,Sam Worthington|Zoe Saldana|Sigourney Weaver|Stephen Lang|Michelle Rodriguez,http://www.avatarmovie.com/,James Cameron,Enter the World of Pandora.,culture clash|future|space war|space colony|society,"In the 22nd century, a paraplegic Marine is dispatched to the moon Pandora on a unique mission, but becomes torn between following orders and protecting an alien civilization.",162,Action|Adventure|Fantasy|Science Fiction,Ingenious Film Partners|Twentieth Century Fox Film Corporation|Dune Entertainment|Lightstorm Entertainment,12/10/09,8458,7.1,2009,240886902.887613,2827123750.41189
140607,tt2488496,11.173104,200000000,2068178225,Star Wars: The Force Awakens,Harrison Ford|Mark Hamill|Carrie Fisher|Adam Driver|Daisy Ridley,http://www.starwars.com/films/star-wars-episode-vii,J.J. Abrams,Every generation has a story.,android|spaceship|jedi|space opera|3d,"Thirty years after defeating the Galactic Empire, Han Solo and his allies face a new threat from the evil Kylo Ren and his army of Stormtroopers.",136,Action|Adventure|Science Fiction|Fantasy,Lucasfilm|Truenorth Productions|Bad Robot,12/15/15,5292,7.5,2015,183999919.040035,1902723129.80182
597,tt0120338,4.355219,200000000,1845034188,Titanic,Kate Winslet|Leonardo DiCaprio|Frances Fisher|Billy Zane|Kathy Bates,http://www.titanicmovie.com/menu.html,James Cameron,Nothing on Earth could come between them.,shipwreck|iceberg|ship|panic|titanic,"84 years later, a 101-year-old woman named Rose DeWitt Bukater tells the story to her granddaughter Lizzy Calvert, Brock Lovett, Lewis Bodine, Bobby Buell and Anatoly Mikailavich on the Keldysh about her life set in April 10th 1912, on a ship called Titanic when young Rose boards the departing ship with the upper-class passengers and her mother, Ruth DeWitt Bukater, and her fiancé, Caledon Hockley. Meanwhile, a drifter and artist named Jack Dawson and his best friend Fabrizio De Rossi win third-class tickets to the ship in a game. And she explains the whole story from departure until the death of Titanic on its first and last voyage April 15th, 1912 at 2:20 in the morning.",194,Drama|Romance|Thriller,Paramount Pictures|Twentieth Century Fox Film Corporation|Lightstorm Entertainment,11/18/97,4654,7.3,1997,271692064.214419,2506405735.41947
24428,tt0848228,7.637767,220000000,1519557910,The Avengers,Robert Downey Jr.|Chris Evans|Mark Ruffalo|Chris Hemsworth|Scarlett Johansson,http://marvel.com/avengers_movie/,Joss Whedon,Some assembly required.,new york|shield|marvel comic|comic|superhero,"When an unexpected enemy emerges and threatens global safety and security, Nick Fury, director of the international peacekeeping agency known as S.H.I.E.L.D., finds himself in need of a team to pull the world back from the brink of disaster. Spanning the globe, a daring recruitment effort begins!",143,Science Fiction|Action|Adventure,Marvel Studios,4/25/12,8903,7.3,2012,208943741.897494,1443191435.20607
135397,tt0369610,32.985763,150000000,1513528810,Jurassic World,Chris Pratt|Bryce Dallas Howard|Irrfan Khan|Vincent D'Onofrio|Nick Robinson,http://www.jurassicworld.com/,Colin Trevorrow,The park is open.,monster|dna|tyrannosaurus rex|velociraptor|island,"Twenty-two years after the events of Jurassic Park, Isla Nublar now features a fully functioning dinosaur theme park, Jurassic World, as originally envisioned by John Hammond.",124,Action|Adventure|Science Fiction|Thriller,Universal Studios|Amblin Entertainment|Legendary Pictures|Fuji Television Network|Dentsu,6/9/15,5562,6.5,2015,137999939.280026,1392445892.5238
168259,tt2820852,9.335014,190000000,1506249360,Furious 7,Vin Diesel|Paul Walker|Jason Statham|Michelle Rodriguez|Dwayne Johnson,http://www.furious7.com/,James Wan,Vengeance Hits Home,car race|speed|revenge|suspense|car,Deckard Shaw seeks revenge against Dominic Toretto and his family for his comatose brother.,137,Action|Crime|Thriller,Universal Pictures|Original Film|Media Rights Capital|Dentsu|One Race Films,4/1/15,2947,7.3,2015,174799923.088033,1385748801.47052
99861,tt2395427,5.944927,280000000,1405035767,Avengers: Age of Ultron,Robert Downey Jr.|Chris Hemsworth|Mark Ruffalo|Chris Evans|Scarlett Johansson,http://marvel.com/movies/movie/193/avengers_age_of_ultron,Joss Whedon,A New Age Has Come.,marvel comic|comic|sequel|superhero|vision,"When Tony Stark tries to jumpstart a dormant peacekeeping program, things go awry and Earth’s Mightiest Heroes are put to the ultimate test as the fate of the planet hangs in the balance. As the villainous Ultron emerges, it is up to The Avengers to stop him from enacting his terrible plans, and soon uneasy alliances and unexpected action pave the way for an epic and unique global adventure.",141,Action|Adventure|Science Fiction,Marvel Studios|Prime Focus|Revolution Sun Studios,4/22/15,4304,7.4,2015,257599886.656049,1292632336.88177
12445,tt1201607,5.711315,125000000,1327817822,Harry Potter and the Deathly Hallows: Part 2,Daniel Radcliffe|Rupert Grint|Emma Watson|Alan Rickman|Maggie Smith,http://www.harrypotter.com,David Yates,It all ends here.,self sacrifice|magic|frog|sorcerer|school,"Harry, Ron and Hermione continue their quest to vanquish the evil Voldemort once and for all. Just as things begin to look hopeless for the young wizards, Harry discovers a trio of magical objects that endow him with powers to rival Voldemort's formidable skills.",130,Adventure|Family|Fantasy,Warner Bros.|Heyday Films|Moving Picture Company (MPC),7/7/11,3750,7.7,2011,121174755.323934,1287183997.56487
109445,tt2294629,6.112766,150000000,1274219009,Frozen,Kristen Bell|Idina Menzel|Jonathan Groff|Josh Gad|Santino Fontana,http://movies.disney.com/frozen,Chris Buck|Jennifer Lee,Only the act of true love will thaw a frozen heart.,queen|musical|princess|betrayal|snowman,"Young princess Anna of Arendelle dreams about finding true love at her sister Elsa’s coronation. Fate takes her on a dangerous journey in an attempt to end the eternal winter that has fallen over the kingdom. She's accompanied by ice delivery man Kristoff, his reindeer Sven, and snowman Olaf. On an adventure where she will find out what friendship, courage, family, and true love really means.",102,Animation|Adventure|Family,Walt Disney Pictures|Walt Disney Animation Studios,11/27/13,3369,7.5,2013,140405002.911063,1192711491.11985
68721,tt1300854,4.946136,200000000,1215439994,Iron Man 3,Robert Downey Jr.|Gwyneth Paltrow|Guy Pearce|Don Cheadle|Ben Kingsley,http://marvel.com/ironman3,Shane Black,Unleash the power behind the armor.,terrorist|war on terror|tennessee|malibu|marvel comic,"When Tony Stark's world is torn apart by a formidable terrorist called the Mandarin, he starts an odyssey of rebuilding and retribution.",130,Action|Adventure|Science Fiction,Marvel Studios,4/18/13,6882,6.9,2013,187206670.548084,1137692372.63862
211672,tt2293640,7.40416499999999,74000000,1156730962,Minions,Sandra Bullock|Jon Hamm|Michael Keaton|Allison Janney|Steve Coogan,http://www.minionsmovie.com/,Kyle Balda|Pierre Coffin,"Before Gru, they had a history of bad bosses",assistant|aftercreditsstinger|duringcreditsstinger|evil mastermind|minions,"Minions Stuart, Kevin and Bob are recruited by Scarlet Overkill, a super-villain who, alongside her inventor husband Herb, hatches a plot to take over the world.",91,Family|Animation|Adventure|Comedy,Universal Pictures|Illumination Entertainment,6/17/15,2893,6.5,2015,68079970.0448131,1064192016.79551
38356,tt1399103,0.760502999999999,195000000,1123746996,Transformers: Dark of the Moon,Shia LaBeouf|John Malkovich|Ken Jeong|Frances McDormand|Josh Duhamel,http://www.transformersmovie.com/,Michael Bay,The invasion we always feared. An enemy we never expected.,moon|spacecraft|traitor|bodyguard|fighter jet,"Sam Witwicky takes his first tenuous steps into adulthood while remaining a reluctant human ally of Autobot-leader Optimus Prime. The film centers around the space race between the USSR and the USA, suggesting there was a hidden Transformers role in it all that remains one of the planet's most dangerous secrets.",154,Action|Science Fiction|Adventure,Paramount Pictures|Di Bonaventura Pictures|Hasbro|Indochina Productions,6/28/11,2456,6.1,2011,189032618.305337,1089358138.29044
122,tt0167260,7.122455,94000000,1118888979,The Lord of the Rings: The Return of the King,Elijah Wood|Ian McKellen|Viggo Mortensen|Liv Tyler|Orlando Bloom,http://www.lordoftherings.net,Peter Jackson,The eye of the enemy is moving.,elves|orcs|middle-earth (tolkien)|based on novel|suspicion,"Aragorn is revealed as the heir to the ancient kings as he, Gandalf and the other members of the broken fellowship struggle to save Gondor from Sauron's forces. Meanwhile, Frodo and Sam bring the ring closer to the heart of Mordor, the dark lord's realm.",201,Adventure|Fantasy|Action,WingNut Films|New Line Cinema,12/1/03,5636,7.9,2003,111423148.609557,1326278010.47567
37724,tt1074638,5.603587,200000000,1108561013,Skyfall,Daniel Craig|Judi Dench|Javier Bardem|Ralph Fiennes|Naomie Harris,http://www.skyfall-movie.com,Sam Mendes,Think on your sins.,spy|secret agent|fall from height|sociopath|james bond,"When Bond's latest assignment goes gravely wrong and agents around the world are exposed, MI6 is attacked forcing M to relocate the agency. These events cause her authority and position to be challenged by Gareth Mallory, the new Chairman of the Intelligence and Security Committee. With MI6 now compromised from both inside and out, M is left with one ally she can trust: Bond. 007 takes to the shadows - aided only by field agent, Eve - following a trail to the mysterious Silva, whose lethal and hidden motives have yet to reveal themselves.",143,Action|Adventure|Thriller,Columbia Pictures,10/25/12,6137,6.8,2012,189948856.270449,1052849482.6268
1642,tt0113957,1.13661,22000000,1106279658,The Net,Sandra Bullock|Jeremy Northam|Dennis Miller|Wendy Gazelle|Ken Howard,,Irwin Winkler,Her driver's license. Her credit cards. Her bank accounts. Her identity. DELETED.,cheating|new identity|computer virus|chase|computer,"Angela Bennett is a freelance software engineer who lives in a world of computer technology. When a cyber friend asks Bennett to debug a CD-ROM game, she discovers a conspiracy that will turn her life upside down. Soon, her records have been erased, and she's been given a new identity and a police record. Her vacation is ruined as she struggles to determine why she's been deleted from society.",114,Crime|Drama|Mystery|Thriller|Action,Columbia Pictures,7/28/95,201,5.6,1995,31481271.0763532,1583049536.35242
49026,tt1345836,6.591277,250000000,1081041287,The Dark Knight Rises,Christian Bale|Michael Caine|Gary Oldman|Anne Hathaway|Tom Hardy,http://www.thedarkknightrises.com/,Christopher Nolan,The Legend Ends,dc comics|crime fighter|terrorist|secret identity|burglar,"Following the death of District Attorney Harvey Dent, Batman assumes responsibility for Dent's crimes to protect the late attorney's reputation and is subsequently hunted by the Gotham City Police Department. Eight years later, Batman encounters the mysterious Selina Kyle and the villainous Bane, a new terrorist leader who overwhelms Gotham's finest. The Dark Knight resurfaces to protect a city that has branded him an enemy.",165,Action|Crime|Drama|Thriller,Legendary Pictures|Warner Bros.|DC Entertainment|Syncopy,7/16/12,6723,7.5,2012,237436070.338061,1026712780.23392
58,tt0383574,4.205992,200000000,1065659812,Pirates of the Caribbean: Dead Man's Chest,Johnny Depp|Orlando Bloom|Keira Knightley|Bill Nighy|Jack Davenport,http://disney.go.com/disneypictures/pirates/,Gore Verbinski,Jack is back!,witch|fortune teller|bondage|exotic island|monster,"The high-seas adventures of happy-go-lucky troublemaker Captain Jack Sparrow, young Will Turner and headstrong beauty Elizabeth Swann continues as Sparrow works his way out of a blood debt with the ghostly Davey Jones, he also attempts to avoid eternal damnation.",151,Adventure|Fantasy|Action,Walt Disney Pictures|Jerry Bruckheimer Films|Second Mate Productions,6/20/06,3181,6.8,2006,216333831.658314,1152691351.87119
10193,tt0435761,2.711136,200000000,1063171911,Toy Story 3,Tom Hanks|Tim Allen|Ned Beatty|Joan Cusack|Michael Keaton,http://disney.go.com/toystory/,Lee Unkrich,No toy gets left behind.,hostage|college|toy|barbie|animation,"Woody, Buzz, and the rest of Andy's toys haven't been played with in years. With Andy about to go to college, the gang find themselves accidentally left at a nefarious day care center. The toys must band together to escape and return home to Andy.",103,Animation|Family|Comedy,Walt Disney Pictures|Pixar Animation Studios,6/16/10,2924,7.5,2010,200000000.0,1063171911.0
12155,tt1014759,5.57295,200000000,1025467110,Alice in Wonderland,Mia Wasikowska|Johnny Depp|Anne Hathaway|Helena Bonham Carter|Crispin Glover,http://disney.go.com/wonderland/,Tim Burton,You're invited to a very important date.,based on novel|fictional place|queen|alice in wonderland|fantastic,"Alice, an unpretentious and individual 19-year-old, is betrothed to a dunce of an English nobleman. At her engagement party, she escapes the crowd to consider whether to go through with the marriage and falls down a hole in the garden after spotting an unusual rabbit. Arriving in a strange and surreal place called 'Underland,' she finds herself in a world that resembles the nightmares she had as a child, filled with talking animals, villainous queens and knights, and frumious bandersnatches. Alice realizes that she is there for a reason – to conquer the horrific Jabberwocky and restore the rightful queen to her throne.",108,Family|Fantasy|Adventure,"Walt Disney Pictures|Team Todd|Tim Burton Productions|Roth Films|Zanuck Company, The",3/3/10,2853,6.3,2010,200000000.0,1025467110.0
1865,tt1298650,4.95513,380000000,1021683000,Pirates of the Caribbean: On Stranger Tides,Johnny Depp|Penélope Cruz|Geoffrey Rush|Ian McShane|Kevin McNally,http://disney.go.com/pirates/index-on-stranger-tides.html#/video/,Rob Marshall,Live Forever Or Die Trying.,sea|captain|mutiny|sword|prime minister,"Captain Jack Sparrow crosses paths with a woman from his past, and he's not sure if it's love -- or if she's a ruthless con artist who's using him to find the fabled Fountain of Youth. When she forces him aboard the Queen Anne's Revenge, the ship of the formidable pirate Blackbeard, Jack finds himself on an unexpected adventure in which he doesn't know who to fear more: Blackbeard or the woman from his past.",136,Adventure|Action|Fantasy,Walt Disney Pictures|Jerry Bruckheimer Films|Moving Picture Company (MPC),5/11/11,3180,6.3,2011,368371256.184759,990417500.348983
